helpful 1,helpful 2,review,rating,summary
13,14,"Okay, I'm not using this netting like the other folk, but perhaps you too are  looking for a solution to THAT deer that's so bold he doesn't hesitate to come up onto the porch to nibble the delicious buds off your potted plants.My particular problem this year wasn't that, but it was that someone was dining on the new garden I put in the front yard.  Now, you can't exactly put up deer fencing -- at least not attractively-- at the front of your lawn, but you can protect your plants, it turns out, with this netting.What I did was cut the netting into small swaths which I lay over the plants.  LOL, it apparently has an unpleasant feel on the tongue.  The dear deer hasn't even eaten the lettuces I've got tucked in here and there.  And the best part is that the netting is invisible.  At least I can't see it.So try this out and see if it works for you.  It's allowed us to grow plants that none of our neighbors dare try here in deer-country Virginia.One note of caution:  You need to check periodically to make sure that blossoms don't work themselves into the netting.  I've had to work some free so they could open.Pam T~happy gardenerI'll report back if there's a failure at any point",5,I'm Using This a Little Differently...
0,0,"Easy to handle but came with no stakes or any kind of tie-down. Also, no directions about how to wrap tree. Spaces seem small enough to keep out birds but it really should come with sample pics or directions. We had to take ours down because we wrapped it too tight and the trees were dying.",3,Not for people with 5 thumbs.
0,0,"When I first got this thing, I must admit, I was really dubious. It looks odd and gimmicky. Well, using it in my garden has turned me into a believer! It works great on my thick, clay-heavy soil - quickly cultivating the ground, breaking it up and preparing for my attentions. It works great and I highly recommend it!(Review of Garden Weasel Gold Garden Claw Cultivator #91306)",5,Works great
19,20,"I planned to use the Garden Claw for stand-up cultivation of my raised beds, and it will be great for that; it's perfect for SFG-style beds.But this is the best part: I've discovered it's perfect for helping me dig post holes for my grape and kiwi trellises. I'm a 4'10"" disabled woman with bad knees and a bad back. I just don't have the upper body strength to ram a post-hole digger into the clay soil in our fescue-matted field, and the two big, strong men in my household always have something more pressing to do.I discovered the Garden Claw makes a circular hole that's just a tad wider than the post-hole digger does, and I can loosen six or more inches of clay soil and roots in no time. Without strain! Then I can use the post-hole digger to lift out the loosened soil, or I can just spade it out into a bucket for use somewhere else. As weak as I am, I can get two 2-foot holes dug before I have to rest.I've been frustrated because I've been too broke to pay someone to come put these trellises in and worried because I know the vines will be here before I know it. Thanks to the Garden Claw, I can put in my trellises all by myself! It paid for itself the very first day. So far, I'm delighted with it.",5,Being able to do it myself: Priceless!
0,0,"I bought my garden claw several years ago. I was looking for something to help turn compost into my vegetable gardens.The criterion I was looking for was something inexpensive that wouldn't break the bank the way a tiller would. But would still get the job done without causing me to be laid up with back pain for a week. For the most part I have been very pleased.We have 2- 12'x12',and  2-8'x8' beds  along with a few smaller freestyle plots, and we mainly use the claw to add compost and cow manure to them every Spring . With the claw I am able to quickly mix in my amendments, and to loosen up the soil about a half foot down in next to no time. If I want to go extra deep, it does take a double dose of clawing , but it is worth it in the end. And it really is not that much extra work since the soil has been pre-loosened a bit by the first go around.As far as starting a bed from scratch, I have used it to start new plots, but only after the sod has been removed. I do think it would be a tough chore to try to do a new bed from start to finish, with only the Claw,and without removing the grass first, but not impossible.When weeding I find it invaluable for use in between rows. It is a breeze to simply stick the claw into the center of a clump of weeds and give a twist and a tug and be done.My one complaint is that the handle has come a tad bit loose. It is still perfectly functional and it took about 5 or more years of good solid use for that to happen, but for someone with a larger plot who uses it more often it may be a concern.",4,A Tool That Really Helps Get it Done
5,16,"We bought the Garden Claw several years ago at our first house and never used it, because the handles are mounted for lefties.  That is, the two hand-grips are each curved to the side, giving a feel of turning a wheel when you use it.  This would be great if you put your hands on the grips and turned it to the right to dig.  But the tines on this gadget are positioned so that you have to ""steer"" the Claw to the left to get them to dig.  Since us righties have more strength in our right hands, it was very awkward to ""steer"" the Claw to the left.  We spent about 20 minutes with it in the garden that day and haven't used it since.",2,Handles are on backwards!
77,78,"This is a handy tool for cultivating small areas, but it is not appropriate for anything more than a medium sized flowerbed.  The handles work well to gain leverage, but you will feel it in your muscles if you  attempt to do too large an area!The fact that it isn't powered lets  you get into areas you wouldn't want to go with even the smallest of  tillers, and it does a great job of breaking up the ground to a depth of a  couple of inches, which is perfect for flowers.For larger projects, use  a mini-tiller, and use this tool for the detail work and the smaller beds.  Both tools are a good combination to have at your disposal.",4,Handy tool for its purpose
0,0,"Currently I hate this thing.  I may need to oil it/adjust it or make some other modifications but it squeaks of metal on metal and cuts about 1/3rd of the grass I pass over with it.  I found a manual mower like this in the yard of the first home I bought and used it for years.  It was better than any mower I've ever owned.  This seems to perform like a cereal box toy imitation of what a manual push mower is supposed to be like.  Pooptastic.  I will update this review if I am able to modify it to actually cut grass, but out of the box it seems to make far too many blade passes per distance traveled to ever perform well.  Also the last model I had had two counter-rotating blades and this only has one rotating in one direction against a stationary blade/block.",1,Currently I hate this thing
1,1,"I'm not sure how I missed that important point, but I did.  I don't see that clearly mentioned from scott's, either.  This particular model with the four wheels makes it nearly impossible to use on hills.  It just doesn't have the leverage to cut the grass.  So I'm back to the mower.  One thing I will say is that it cuts well on flat surfaces, but it does require a bit more effort than I thought to push.",2,Not For Hills
0,0,"A couple of years ago my husband decided to shove our old mower in the shed and buy this push mower with the sharpening kit and grass catcher. His motivation was that this mower would not pollute and was ecologically responsible.While it isn't hard to maintain or use and it can be adjusted for height easily, I am a finicky type and I really don't care for the job this mower does. I miss the good old days when my lawn looked perfectly manicured with neat paths of freshly mowed grass.The positive in regard to this mower is that it cuts a wide path which theoretically is time saving and efficient. The negatives are more numerous. The handle on this mower has fatigued 6 times in two years. I have ordered replacement handles a couple times after duct taping proved to be a poor fix at best. The grass catcher has been replaced twice because it fell apart. We are on our second sharpening set. The most irritating aspect  of having this mower is that it does a poor job if the grass gets too long between mowings. The weird weather conditions this spring has resulted in my grass seeding twice and growing like crazy. Long strands of germinating grass stand in contrast to the parts that actually do get cut. Most of the time, my husband mows the lawn twice in an attempt to get it even. Usually that makes little difference as to the lawn's overall appearance.This is a cheap mower. It might be great for someone who has a small yard, but my yard isn't small. This mower Isn't even close to my grandpa's old push mower that really tamed an unruly lawn and was solid.  Last night I had to order a new handle and another sharpening kit.Today I am going to buy a nice power driven Toro and I'll mow the lawn from now on.",3,Nothing To Brag About
166,176,"Everyone I know advised me against getting a reel mower.  I was cautioned that they don't cut well and they're hard to push.  But I didn't consider a gas mower an option (too expensive, noisy, hard to maintain, and dangerous), a corded electric would be too cumbersome, and a rechargeable would be impractical because there is not a convenient place for me to charge it.  So I took the plunge and bought this one.I'm completely intimidated by all things mechanical, so I was worried about assembling this mower, but it really is easy.  The only thing you have to do is screw the five sections of the handle together, then clip it onto the mower body.  The instructions were adequate (3.5 stars there), even for an assembly-phobe like me.  The current configuration does not require any tools for assembly, but there was an add-on bag of washers and nuts included with my mower that are recommended for a more securely assembled handle.  If you opt to use the new nuts instead of the original wingnuts, you'll need a wrench.After just fifteen minutes or so, I was up and running.  To my delight, the mower pushes easily, even through long grass.  And it's very entertaining to watch the grass being rapidly snipped off.  I felt like Edward Scissorhands.  Who would have thought mowing grass would be so fun?  I was a little tired and winded when I finished (in a good way), but I had been practically running with this thing because I enjoyed it so much.  I kept looking for stray patches to go over again, but, alas, the mower did such a good job, when I was finished, my yard looked like a golf course.A few facts about me and my lawn to see if my wholehearted recommendation will apply to you:  I'm female, plus-sized, totally out of shape, and usually quite sedentary (one reason I thought this would be a good idea).  I had never mowed grass before in my life (didn't have a yard before last summer, and then I accepted the fine services of a neighborhood girl with a ride-on mower who worked cheap).  My yard is about 6500 square feet, level, fairly flat, and covered with long pine needles all over the place (the mower didn't even notice them).Some older reviews address a couple of problems that are no longer an issue:  Scotts now (late April 2007) packages the mower with the cushioned handgrip already on, and the apparently easily loosened wingnuts (as already mentioned) can now be replaced with regular nuts (not mentioned in the current manual, but included in the box with a note).  Scotts should have included shorter bolts with the new nuts (since you now don't need the extra length the wingnuts required), but this is a trivial point.  Put your wingnuts on after the new nuts for a more ""finished"" appearance.A reel mower might not be suitable for everyone and every yard, but for me, it's fantastic.  It's quiet, easy to maneuver, non-intimidating, good exercise, fun, environmentally sound, and inexpensive.  I couldn't be happier with this mower.UPDATE 1-17-13I used my mower for the whole season and never had any problems with it.  The next year, health issues forced me to again use the services of the neighborhood girl to mow my lawn.  Then I got married, and my husband wanted nothing to do with a reel mower (though he admitted that it was cool, he'd always used a gas mower, and that's what he wanted to stick with, though I HATE the noise and smell when he mows).  So my Scotts sat in storage for years, and last fall Hubby finally convinced me to let it go.  I sold it for $50 to a single mom with a tween daughter who was going to mow their small lawn.  I let them try it out on our grass, and they were both immediately thrilled and couldn't wait to get home to use it.  I felt like I was kind of passing on a torch.  There's something wonderfully enabling about this mower.  If I found myself again being the person responsible for mowing a small-to-medium-size lawn, I would definitely buy another one of these.",5,You gotta try this!
2,2,"It's a classic all right, but a clever classic.  This mower is a straight forward push reel mower with a few nice touches.  That second set of wheels replace a roller all right and the clever height adjustment let's you know that someone gave some thought to this device.  One of the one-star complaints regarding this mower involves the difficulty pushing it.  Well, you can alleviate that by simply adjusting the closeness of the blade  or even the angle of the cut; mine was initially a real bear because the blade was factory adjusted to such a closeness that the reel blades added enormously to the drag, far more than the grass did.  Once you've tapped in an adjustment to the closeness of the blade to its stropping plate (remember just 1/4 turn at the most and oil all the blades) it'll be close to effortless.  The main thing, however, is that reel mowers do such a pretty cut.",4,"snip, snip"
0,0,"Works like a charm. Put it together in a few minutes and cut an overgrown yard at a cabin. Had to make two passes - one at the highest length and one at desired length. The tall weeds did not cut, but I cut them with a lopper. Much easier to maneuver than my power mower and trimmer-mower.",5,Reel Easy to Use
2,2,"I have had many people look at and watch me as I mowed our lawn for the first time with this reel mower and all I could think is that these people think I'm going green... well I'm not. I have always lived a conservative life, recycled (still do), and so on. And not because some celebrity told me I should or whatever, but because it just makes sense to do so. So with that out of the way, onto the actual product.When gas prices peaked last summer we stopped using our lawn tractor because it used just too much gas (and it didn't cut the grass all that well to begin with) and just used our self propelled Honda mower. Well after the tractor sat all summer we decided to just sell it and buy a reel mower and so far it has more then paid for itself.The first question EVERYONE asks is, is it hard to push? Plain and simple, NO. These new reel mowers are lighter and are better designed so they are much easier to push then the old Leave It To Beaver style reel mowers. Also the rear stabilizer wheels also makes it easier to handle.The second question that is asked is, how well does it cut the grass. Well that depends on how tall the grass is, how wet it is, etc.. A reel mower cuts with a sheering action (like scissors) instead of a tearing action that is associated with a rotary mower. This leaves your grass in a much healthier state then the tearing action does. Now I will say that it is harder to cut tall grass and we have to mow more often, but that's the nature of the beast.After mowing the lawn for a few weeks with the Scotts 20 inch reel mower I can actually tell a difference in the grass, much better and healthier looking.The only gripe I have is the handle is a bit flimsy and wobbles a lot... kind of a pain when you execute a turn. We'll probably end up welding it together so it doesn't wobble.All said and done it's a bit more work then using our self propelled Honda, but produces a much better looking lawn.Pros:Fairly cheap upfront cost.Little to no upkeep.Leaves your lawn looking awesome.At least ten times quieter then pretty much any rotary mower, thus allows your to keep your windows open when you are mowing.No fumes (darnit I love the smell of gas!).20"" mower path.Cons:Made in China...Some plastic pieces, not sure how they are going to last but we'll see.Wobbly handle.",5,"Not going green, just saving gas money..."
3,3,"I really like this mower a lot.  I have owned a Brill and Sunlawn, but I like the Scotts classic better than either.  I do have a 40 year old Scotts Deluxe that is substantially heavier and which I like the best of all.  I use the old Scotts Deluxe for mowing my own yard and leave the Scotts classic in my trunk to mow rentals.  Here are my pros and cons.Pros.1. Heavier than others.  That makes it less likely to slip when going over uneven lawn or wet grass. It also has more reel momentum making it cut tall floppy grass and leaves better.2. Handle comes off easily.  There are little clips that hold the handle in, but I do not use them. I just pop the handle on and off, making it easy to store in my trunk and use any time.3.  No gas, much, much lighter and smaller than a gas mower. Of course this is true of all reel mowers, but it is an important point for me.  I can leave this in my trunk and not worry about gas fumes or about refilling gas.  It is always ready to go.  With the handle off, it does not take up too much of my trunk and it is light enough to easily take in and out of my trunk.4. Durable.  You might not think of this with a reel mower, but it saves me nice money in maintenance.  I actually mow several rental lawns weekly.  With that much mowing I have to take my mower in for maintenance every year.  Also I have bent the crankshaft on multiple mowers.  The only maintenance on this is sharpening the blade.5.  Easy to sharpen the blade.  This mower is made by American Lawn Mower, which means it can use the very easy, very cheap american lawn mower sharpening kit available from amazon and tons of other places for under $20.  I like the kit and feel I get a better cut with this mower than I did with the brill or sunlawn models.6. Quiet. Maybe it is a little louder than the brill, but it is still super quiet.  If I feel like mowing in the middle of the night, just because I can, I do and it bothers noone.  Now when I use a gas mower, the noise really bothers me.Cons.1. Handle is super flexy.  They really cheaped out on the handle. The sunlawn and brill models are much stronger.  It works and lasted a heavy use season, but it will not last as long as the body.2. Tough time with weeds. Like all reel mowers, this thing does not like to mow anything that is tall and floppy. This one handles weeds and tall grass much better than average, but you should still try to hold down the weeds and cut weekly if possible. That being said my sister often forgets to mow her weedy lawn for a few weeks, and I am able to mow it with my Scotts classic when her sunlawn would have more difficulty.",5,"Great mower, lousy handle"
0,0,"I hate gas powered tools! I bought this as a hopeful solution to that problem. Obstacles are a definite problem. The maneuverability is quite limited. With a gas mower you could tilt the back end up and over some small obstacles. That wasn't the biggest problem. A little extra weed whipping to be done. The biggest problem is the quality of the cut. If your grass is not perfect plush growth like a golf course the cut will be OK not great. This mower is for people who LOVE grass. Not for people who HATE gas powered tools because you have to mow almost every other day. I hate mowing and grass. I mow mine down to the ground every time and hope it doesn't rain so I wont have to do it again for 2-4 weeks. Some people coddle their grass. They think of it as a family member. They talk about their grass non-stop. They can have a discussion about bagging over mulching for over an hour. They have chemicals for weed control, ants, grubs, PH balance, feed. They seed and water regularly. They spend several hundred dollars every year on their lawns. Their passion for their grass is second only to their family. If this sounds like you, great! It's great to have a passion and this mower is for you. If you mow your lawn down to the dirt and curse at gas powered tools and HATE mowing. This mower is not for you.",2,For folks who LOVE Grass. Not for people who HATE gas powered tools
1,1,"I wish I could say that I purchased this mower after seeing Al Gores ""inconvenient truth"" and my life was changed by it.  The truth however is that I finally got fed up with my old power mower failing to start for the ump-teenth time after repeated repairs and promises of it now ""running like a champ"".  This old time mower will take some getting used too, and also don't kid yourself, it doesn't do the job as easily as a power mower by any means.  However on the plus side you will never again suffer through a mower that fails you, needs fuel, requires any real maintenance like oil changes or plugs, and best of all if you take care of it, will be the very last mower you ever buy.  The only way this mower will up and quit is if you do.  Any maintenance it does require is easily handled by a screwdriver or wrench.  Even for those whose knowledge of small gas engines doesn't go much beyond kicking it and swearing when it disappoints you. I fully agree with the reviewer here who stated it is best used on pristine lawns with lush healthy grass. (Unfortunately a lot of people that have lawns of such quality often don't cut their own lawns. If you happen to be the exception, read on) This mower cuts thick grass of reasonable length straight and evenly very easily.  Where it fails you is on long loose weeds fluttering in the wind.  The mower passes right over them no matter how many times you try again and again to sever it.  I solved that problem by putting a little more effort into trimming with the weed whacker, and leaving the heavy grass to the mower.  And it by far is most efficient when used regularly once or twice a week.  A time table you will find effortlessly fits most peoples lifestyle since the mower is so light and easy to use that mowing the lawn will no longer be an all day Saturday event.  Unlike lawns where power mowers are used that usually get long and seedy looking in between jobs, you will find yourself taking this mower out far more often just to hit the ""high spots"".  Thus your lawn comes to have the appearance of a man that gets his hair cut every three weeks and thus never looks like he is long overdue.  You can also get away with using this mower early in the morning or late in the evening since it makes very little racket. And one last thing, I didn't notice much difference in the physical effort needed to push it considering that most people use walk behind push mowers in any event.  Aside from having to use it a little more often, and its lack of cutting power on long weeds, I consider this mower to be well worth one's investment.  You will eventually come to find your lawn never looked better.",4,Good Choice......But only if you have the time to mow more often
5,16,"Cuts well, etc.; but was missing some Nyloc nuts from the hardware baggie so my dad went to the store to get more.  After assembly it was fine.  But who needs that added hassle?",2,Missing Hardware in the Kit
1,2,"I was really looking forward to trying out a reel mower and living a life of maintenance free mowing. It didn't work out. The second time I used it, the grass had gotten a little high, so there was a lot of back and forth action. It took forever, really. I know that this product isn't meant for that, but that was my situation. Anyway, as I was finishing the handle came apart. There are four wingnuts and bolts holding the assembly together, and one on each side had apparently worked their way off while I was mowing without me noticing. The third one came off as I was putting it away and the handle came apart.Yeah, I was putting a lot of stress on it compared to a regular mowing, but that should not have happened. I followed the assembly instructions to the letter. It was really a very simple assembly. I didn't miss any steps or try to do it without reading the instructions, though. I was very disappointed with this product.If you have a flat yard and are going to be able to keep it mowed short without ever letting it get out of hand AT ALL (like leaving town for a couple weeks), this mower may be for you.If you have a sloped, lumpy yard, do not buy this product. Just don't. It is so hard to use. I honestly think I would like it if I had a nice, flat yard, but as it is this thing was worthless to me.",1,Broke on Second Use
