helpful 1,helpful 2,review,rating,summary
0,0,"These shears cut just as well as standard ones, without the back strain.  Also very easy to reach under bushes, plants, etc. to do a better job of trimming.  They seem pretty sturdy as well.  Very happy with this purchase.  Only caveat--if you are tall I think the handle would be a bit short and still require some bending.",5,Better than I expected!
0,0,I guess this might be ok if you had one VERY SMALL area to trim but it is very tedious and time consuming to use to trim multiple areas. I tried it out but decided to return it. Instead I broke down and purchased a cordless string trimmer (18 volt) which I love and does the job much quicker and easier than this thing could ever hope to do. I wanted it to work for me but no way!,2,Too time consuming and tedious to use
1,1,"Action works well enough, but the blades only cut if you use the very tips.  I expected better from Fiskars because I have several other Fiskars hand tools.",2,Not useful at all
0,0,"These Fiskars 9210 Long-Handled Swivel Grass Shears will literally save wear and tear on your back and knees both when you have any small yard trimming to do. These are not made for grass trimming around the perimeter of a large yard, as your hand would wear out from squeezing the handle. We use the electric string trimmer to trim the grass against the fence around our entire yard. As for all the other trimming in the yard- around the house, the garage, around bushes, trees, sidewalks, the patio, gardens, corners and utility poles, these Fiskars Grass Shears are just perfect!These shears are meant to trim grass and lighter plants, not anything thick, but since grass is always growing around everything in our yard, they get a constant workout.  The 3 foot height is just perfect- no bending or stooping ever. There is an orange turning device on the blades, allowing you to turn these blades to any angle you need. The blades actually turn a full 360 degrees. The 5 inch blades are fully hardened for long lasting sharpness and also lock for storage or when you are turning them. We noticed they do come with a slight oil on the blades themselves.I contacted Fiskars and asked about any maintenance for the blades, and they told me they should stay sharp for years, but you could add a sharper edge to them in time with a hand sharpener- similar to a lawn mower blade sharpener. Cleaning and lightly oiling them when they become dirty will keep them cutting perfect.  Fiskars actually has a lifetime guarantee against any defects in workmanship.  For under $35.00, these are a must have for saving my back and knees with the constant maintenance of yard trimming. These are not just for older people, as I've always had bad knees- and I wish I had known about these years ago!The thought of trimming all the constant grass around the yard made me not want to do it. I'd have to get out my small shears, my knee pad or a stool to sit on- depending on the height of the grass or weeds. Afterwards, I'd need my heating pad and linament for my aching back and knees, not to mention Aleve or some other pain killer. Spending so much time in pain made me dread trimming. Now, I just grab the Fiskars Long Handled Shears- stand, trim and that's it. These shears are worth much more than 5 STARS, and I know I will never be without them again, as saving my back and knees are worth everything!",5,HUGE Back AND Knee Saver For Yard Trimming
5,5,"Fiskars badly missed the target on this one.  Kudos to them for trying to fill the niche though, but in all honesty, this is almost as bad as having nothing at all.  Yes, it does work, but not very well. Yes, it's sharp out of the box, but won't stay that way for long.  I'll take a wild guess and say that no one in their R&D; department actually used the finished product.  If they did, they'd realize that it's an effective trimmer for 10 sq feet of grass (maybe less).  After that, ergonomics, build quality, and most importantly, fundamental design flaws reveal how a great idea can become a poorly executed product.First, the blades need to ride above the grass by way of wheels or some sort of slick bump underneath.  Second, the steering knob needs to be larger, adjustable, and attach to the pole instead of the top handle.  Third, the gauge of wire should be beefed up - there's too much flex in the existing one.  Fourth, the pole should be at least 4"" longer. Fifth, the quality of plastic could be upgraded for use in a harsher environment (or dispose of plastic altogether).  Lastly, the blades should at the very least, be made out of steel -- bonus points for drop forged and hardened!I completely understand the price point vs quality quandary manufacturers face, but here they really took the low-end, budget approach.  It seems Fiskars tried to implement their fine line of inexpensive scissors to the lawn/garden environment.  The quality of materials is perfectly suited for indoor gardening, but who here has a living indoor lawn?I guess we'll have to give it a little more time before human-powered lawn equipment becomes available in a wider selection and price points.  I'd definitely be one of the first in line for a better version.",2,Poor execution
0,0,I gave these only three stars because of how they do and feel in your hand.  They will slip in your hand because there a bit slick and hard to hold.  There ok for small cuts and not having to use them a lot at one time.I wouldn't buy these if i had it to do over again.,3,There ok for small cuts
1,1,"I finally broke down and bought a more expensive pair of pruners than usual. The blades on these are great! Small branches and more cut easily, quickly and cleanly. They are certainly a lot more comfortable to hold than the cheap $7 sheers I've purchased in the past.My biggest issue with them so far is the orange hold-close tab broke almost immediately. They have a life time warranty, but of course I threw away the receipt and all of the packing materials.",4,Great blades
0,0,This is a great pruner.  It is easy on arthritic hands and is quite sharp.  It works well on everything except larger branches.,5,Great!!
0,0,"I think I have large hands for a woman but it takes two hands for me to make these pruners work correctly.  I do like the ergonomic aspect and the rolling handle that turns as you squeeze the handles together but it takes two hands for me to do that.8-21-13:  I came back and changed my 5-star rating to a 2-star because yesterday I picked up these shears and walked up the driveway and clipped some Sweet Autumn Clematis to bring that wonderful fragrance into the house.  However, I also clipped and really pinched my right index finger and I was trying to use these pruners with one hand.  They are just too large for me.  I think the swiveling handle is the culprit.  I tried to give them to one of my visiting left-handed brothers and he said no thanks.  They are good and sharp and all but brand new but just too big unless I can use both hands.",2,Fiskars
2,2,Got to love a pruner that is ergonomically correct and puts pressure on the bush and not your thumb and forefinger.  Got to love a pruner that stays sharp after many seasons of work.  Got to love a pruner that stays rust-free even though we leave it out on the back porch.  Shouldn't come as a surprise:  We love anything Fiskars!,5,Still cutting after years of use
0,0,"I have used these for 4 years and love them.  First I'm 70 years old and do have some Arthritis so these are a real boon to me.  If I can get a branch between the blades I can cut it without strain. Strong spring that opens them (nice) but will say if you had small hands might be a bit large for you. The rolling handle took some getting use to, worked well but was different than anything I had used before, like it now though.  I would recommend these to anyone. I have several Fiskars tools, geared loppers, pruning poles etc., and that really is the reason I bought these since the others work great for me and all have held up to work.  When I read some of the bad reviews of these I have to remember some people need instructions on which end of a knife to hold while using.  These let me trim faster and with less effort than anything I have ever used,  believe me I've used several and cussed most of them.  Fiskars also makes others that are smaller in size if these are too large for you.  No I don't work for Fiskars, just totally impressed and sold on their loppers and pruners.",5,Great Pruners
0,0,"These pruners are very easy on your wrists (and I have wrist problems)! They really do cut through limbs just like the photo in the images section! My pruners are on their 3rd summer with little maintenance required. When these finally bite the dust, I'll replace them with another Fiskars PowerGear Pruner. I am right handed and tried using the pruners with my left - it doesn't really work as one reviewer noted.",5,Fantastic Pruners!!!
3,3,"This the next best thing to having a full size lopper in the palm of your hand. It's very strong with a power gear mechanism that makes cutting painless.  Because of the power gear action, the trigger handle rotates, softening the blow when the sheers get through the branch.  With traditional sheers, the snapping action can be painful after an hour or two of heavy duty pruning.These are heavy pruners, the grip is very comfortable.  I've only had these for two years, but it's going strong.  I wouldn't recommend it for professional u because of the exposed coil spring which is likely get clogged or damaged under heavy abuse, but it's great for the home owner.This performs the job of countless other cutting implements (small sheers to a medium duty lopper).  It's not a delicate cutter, but until recently, I was using it to deadhead my flowers with good results.",5,"Clever and Rugged Design, Painless Hand Lopper"
4,4,"I have been doing yard work for 40 years, so I am no ""backyard rookie"".  This pruner fell apart the very first time I used it. The ""PowerGear"" fell off and couldn't be reattached firmly to the pruner. I have used other Fiskar products many times and had normal expectations confirmed.Despite what a few other reviewers might say, everyone has the right to state accurate facts about a faulty product. Poor products deserve bad reviews, both to inform the manufacturer and to warn prospective purchasers about problems encountered. Amazon expects no less.I have processed the return package to send it back to Amazon and will try another unit. That said, I reserve the right to change my opinion should the second unit function properly.",1,Interesting Concept--Bad Execution
3,3,"I've had this pruner for several years, and I've used it for a variety of tasks, including pruning roses and other bushes, to trimming off small tree branches. I've even used it for branches that were probably too thick for the tool, but when you have it handy, sometimes you use a tool for a purpose that it wasn't intended. Even when I try to go through something too large, it hasn't broken or jammed in such a way where I couldn't remove it and take it from another angle to finish the cut. That shows how durable it really is.I've had no issues with using this pruner for all those tasks, as it allows me to trim individual faded rose buds with one hand. The spring-loaded handle keeps the resistance at the right amount so it isn't necessary to fiddle around with it just to keep a decent grip.If I were to lose this pruner, or if it were to finally break, I would not hesitate to purchase another one as a replacement. I'm very satisfied with it and recommend it to anyone looking for this type of tool.",4,"Very useful, very durable, and very comfortable"
1,1,When I placed my order I had some misgivings about these hand pruners. That is because I could not tell by Amazon's photo if this was the pruner I needed and how sturdy it is. Since I have had good luck with Fiskars I decided to go ahead and order it.I received the pruners today and I am going to break one of my rules on writing a review. I prefer to wait and use the product before doing a review. I am doing this because these are obviously TOP QUALITY pruners. Arthritis sufferers please take note of what I am about to say.The very first thing I noticed about the pruners is that the bottom handle ROTATES as you squeeze them. This allows you to put far more power into using these with a LOT LESS effort. A wonderful feature if you do not have a strong grip.The photo made these pruners look to me like they were mostly plastic. I immediately saw that I was wrong. All the parts that count are of high quality metal. I will not use them on large branches but I think they could be used on large branches in a pinch.As soon as I got them out of the box I just had to try them. They were excellent for clipping off very small branches in areas where there was not much room to operate. They are SO EASY to use. Once done with the smaller branches I went to larger ones. They cut them with ease. The literature that came with them claimed that they can cut branches up to 3/4 inch. I believe they could but I refuse to do it. I like these clippers so well that I want to take very good care of them so that means I will not cut branches that size with them. I want these clippers to last a long time for me.In conclusion I am very impressed with these clippers. I intend to post some of my own pictures of these clippers on Amazon because I believe I can do a bit better job. I have never done that before with an Amazon product. That is how impressed I am with these pruners. If I run into a problem with them I WILL EDIT this review as soon as it occurs. I very much doubt I will have to do that. I think 99% of all people who buy these pruners will be happy with them.,5,When I placed my order I had some doubts about this items quality.
0,0,"I needed a pruner to fight bittersweet vine.  Due to several back surgeries I don't have a lot of strength in my hands, so I was looking for a pruner that was light and easy to use.  I got this 15"" Fiskars pruner this weekend in local home improvement store and spent several hours cutting my pesky vines.  The pruner worked great! It cut every vine I found and it was easy!The pruner weights 13 ounces, and has a PowerGear design that really helps amplify the strength needed to do the cutting.  I am attaching a collage of 5 photos (you can find the photos by following 'customers photo' link under the main photo).  The photos show the pruner and some of the vines I cut and took home to measure.Photo #1 and photo #2 show the pruner opened and closed. Photo #3 and Photo #4 show one of the bigger vines I have cut: 3 inches in circumference and a bit over 7/8 inches in diameter. Photo #5 shows the vine that was snaking up one of my big fur trees.Overall, I am very pleased. This pruner was easy to use and did a good job!Ali Julia review",5,"Did a great job on vines around 1"" diameter"
0,0,"These are great.  Had the old ones for years and I confess, they were occasionally abused.  I took a sharpener to the blade and got a few more miles out of them before deciding I needed to break down and buy new ones.  Works on branches that were surprisingly large (sorry!) but I hope to treat these better than the old ones.",5,Wore The Old Ones Out
0,0,"It had been years since I had a new pruner and the one I have most would consider ""vintage"".  So when I chose this pruner, I chose on the brand I know has quality and endurable products.  This pruner is lightweight and sharp.  I didn't realize how good a pruner can when when you have one that works!",5,FISKARS 15-INCH ANVIL LOPPER-QUALITY TOOL
1,1,I used this product to trim shrub and tree branches around my yard. I can easily carry it around the yard because it is the perfect length and is light weight. I will also note that the blades are sharp and pinch through branches with ease. The Fiskars trimmer is a great addition to any garden cart especially if you want a quality trimmer for all your yard work needs.,5,Perfect shrub/tree trimmers
0,0,This little tool is deceiving.  It can cut those thick branches in one swipe.  My husband even uses it.  It is a big surprise what it can cut with no effort.,5,Effortless Cuts
0,0,Finally a decent pair of loppers. Quality construction. I love the gear setup and handles that won't come loose.They are a breeze to use.,5,Great lopper great price
0,0,"The gear mechanism does assist your chopping power.This is a solid branch cutter and as long as you clean your cutting edges,the tool should operate for a long time.",4,Great loppers
0,0,"cuts through branches like butter, not needing a lot of force at all.  super sharp and the design makes it take less energy to get it done",5,genius design
0,0,"These Fiskars are the very thing to have on hand, They cut really good and smooth. I like the long reach too because the short ones you will need a ladder more for taller trees.",5,They cut good and can reach up higher
0,0,"OK, I ordered these because I have some hand pruners by Fiskars and love them. These did not disappoint. I have been using them all over our new yard to cut back overgrown lavender, smoke bush, and branches. Today I thought I'd give them a try in the woods next to the house that ""could"" be a beautiful fire pit or gazebo area... eventually. I took these through dead and alive saplings. And to clarify-these were 1""-3"" saplings. While it handled the recommended size of 2"" easily, I found with some maneuvering and going around the tree in a circle I could also take down larger ones. Then I worked on cutting the smaller branches off, all still cutting with ease like they were brand new. No dulling or sticking- a perfect cut each time.I worked at this for about an hour- plus all the other times I've been out with these... I would definitely buy another pair in the future - but these don/t seem like they will be wearing our anytime soon!",5,OMG- Best loppers ever! Just cleared .25 acres of saplings
0,0,"I cut down two very dead shrubs today using these and was very impressed with these lightweight loppers.  I didn't think I'd get the heavier two-inch branches cut because these loppers are so light, but with the right grip the gear holds the wood down and cuts the branch cleanly in half with little effort.  I'm not the strongest person out there and I'm certainly no Hercules, but these loppers made the trim job for me fairly easy.Although these may be harder to use in dense shrub because you need a wide opening for these to work effectively, once you have a grip on the wood the cutting is easy.  And, since they are somewhat long, you can also reach up rather high.  Overall, a very well-engineered set.They are attractive on top of it, and look impressive in my tool corner.",5,Best in their class
0,0,"Fiskars 32 Inch PowerGear Bypass Lopper (9154).  Now this is a great Lopper, I use it a lot and it makes trimming easy.",5,Fiskars 32 Inch PowerGear Bypass Lopper (9154)
0,0,"Love it, one of best products I have ever ordered period. I couldn't believe how effordless this thing cuts thru even thick branches several inches wide. It is very easy to use, light in weight but very solid construction and feel,  even makes cutting branches fun if you can believe that. I cut down twenty branches and three small trees in under a few minutes. I was looking around for more things to cut. Seems very well built. I can't think of a single thing that could have added on this thing to make it better Price is great. One reviewer gave it one star because the blade is curved so you have to open the tool's jaws slightly more. I am not sure but would bet the curved blade has something to do with just how easy this thing cuts. I have another cutter that doesn't have curved blades and it can't cut nowhere near as powerful as this tool. Tool is fantastic. Very Highly recommend Many Times over!!! Would give it twenty stars if could!!!! Good job to the people who designed this product!!",5,"Love it, one of best products I have ever ordered period."
0,0,"There is power to spare with this lopper. Yes, it has to open very wide to get around the cutting target but if the space permits you to do so the cutting part is almost effortless. This is hands down the best lopper I have ever used as far as ease of cutting. When I finished clipping I decided to apply a bit of oil from the Fiskars Cutting Tool Care Kit that I had purchased. As I was applying the oil I noticed that the black cutting blade had a bright spot. Closer inspection revealed the bright spot was actually a nick in the blade. This was a major letdown after the feeling that resulted from the cutting prowess. I had to delete a star due to the nick and hope that it was just a  rare flaw in the metal. Other than the nick this is a top notch lopper.",4,They Have The Power
0,0,"This 32 inch loppers is a great addition to our yard work tools!! I am a short lady, and have no problem snipping branches around our yard. The long sturdy handles make it easy to get leverage and trip harder to reach branches, and I have seen great improvement in our curb appeal because of this great loppers!",5,~LOVE these Fiskars Loppers!!!!~
0,0,This is a great addition to my growing gardening tool collection.  This tool will make it easier to prune tall tree limbs in the fall.  The Fiskars quality in sewing instruments in why I purchase the brand for my outdoor activities.,5,Makes Lopping Easier
2,2,"I bought it in a local store on sale, for $29.99, mine is the same model, only 32"". Funny, because on the fiskars website there's no mention of the product!I compared it to other alternatives, that can cut 2"" branches, and this model came out as number one!It cuts wood like butter!Mine is very light weight, has titanium blade, hollow aluminum arms, with rubber handles.I fear I bought a product that may be more powerful than the product can actually handle! Meaning, it may be good for casual use of cutting branches upto 2"".But perhaps not industrial use!That's why they probably decreased the size of the gripper to 25"" and 31"" instead of 32"".Nevertheless, I just use it for some thorn bushes in my garden, and think it's well worth the $30 I spent!Even mine (32 inch) is very light weight, I can easily lift it up with one arm stretched, to cut off the furthest branches, and I'm a pretty skinny and weak guy!One cutting blade seems titanium, the other some sort of treated metal alloy. Only one of the two is a blade, the other is just a hold for the branch.Unlike other branch cutters I've seen, this one cuts the branch like a scissor, not squeezes the branch like pliers; which means, you won't have branches hanging on threads still on the tree.The cutting mechanism provides clean and easy cuts that separate even the toughest branches (upto 2 inch)!I highly recommend this one!; and that's very high praise coming off of my lips! (those who know me, know I'm usually very skeptic, and thorough in reviewing the bad sides).If anything bad about this device, is that it's not on the manufacturers website (the 32 inch model), and that it's probably not made for mass pruning on an industrial scale, eventhough it would probably outlive a DIY-er pruning gardens in his days off!",5,Best lopper I've ever had!
2,3,"I've usually found Fiskars gardening products to be innovative and effective, but there's usually a kink in the design.  I still swear by the Power Lever shears because the blades move parallel and effortlessly, but the kink is the retaining pin which is a pressure fit which simply loosens with use as the hole in the blades enlarge.  As to this very lovely and innovative Power Gear lopper, well, let's say there are a lot of kinks.  As you may have discovered, the handles break and the blades are fragile.  Just how fragile?  Check Home Depot's website for feedback on this very lopper and you'll even see pictures of the chipped Titanium blade.  It happens a lot, a whole lot.  Quality control may well be to blame, but the material used in the titanium blade is just not solid or steel.  My blade broke or rather chipped the first week of use and the broken surface revealed something that looks like pot metal.  The material in the blade looks like a composite, a grainy composite.  If you look at the blade you'll see that's it's very hefty and designed to withstand a direct applied force, but apparently not a force related to twisting, which would act against the cutting edge with increased leverage due to the unusual depth of the blade and its almost rectangular shape.  So you have high tech materials that when working, operates as advertised, save for that extra span needed to clear the blade around let's say a 2 inch branch.  BUT here's the good news:  Fiskars has replacement blades.  Here's the not so good news:  Fiskars charged me a reasonable $7.99 for the blade, but a very, very hefty shipping and handling ($4.00 for the handling) charge of $11.39, making the modestly priced blade $19.38 to purchase and receive.  The replacement blade (they're determined by the distance between the mounting holes)is steel and shaped like traditional lopper blades:  no more composites, no more thick blades, which tells you something.  As to Power Gear hedge shears, well , count your blessings with the lopper, because there ain't no replacement parts for the hedge shears from Fiskars, and their kink is the composite Power Gear mechanism, which breaks teeth with a passion, rendering the unit useless, unless you have a similarly wounded twin, because the mechanisms are comprised of two sets of power gear parts, that are interchangeable front and rear.  There you go, have fun.",3,you CAN get replacement blades; you'll need it
