helpful 1,helpful 2,review,rating,summary
4,4,"Good USA company that stands behind their products. I have had to warranty two hoses and they send replacements right out to you. I had one burst after awhile, you could see it buldge for weeks before it went so no suprises. The other one was winter related as I am bad and leave them out most of the time. Highly reccomend. Note the hundred footer is heavy and like wresting an anaconda when its time to put away, but it does have a far reach.",4,Great Hoses
0,0,This is a high quality 8 ply hose. I have had good luck with Gilmour hoses in the past. A good choice in hoses.,5,"Gilmour 10-58050 8-ply Flexogen Hose 5/8-Inch by 50-Foot, Green"
2,3,"It's probably one of the best hoses I've ever had.Pro's:- It's good enough for most front yards, or small back yards.- It has enough flow (and with the right head) to water plants 25ft away from the nozzle, and water your garden.- It's light weight, and flexible (it does not pose as much of a problem unrolling this hose with kinks as with other hoses I've owned)- The hose is flexible, yet strong. I haven't cut the outside yet.- This hose has been in full sunlight for more than 3 months, and the rubber hasn't cracked yet! I believe it's good quality rubber.cons:- Like with every hose, keeping it outside in the sunshine, the water warms up and starts smelling.My dog don't want to drink from the water coming from this hose.- The hose is only in one color (I wished it was a little less visible in the gardenOtherwise this hose is an excellent garden tool!I bought 2 of them, one 25ft for my front garden, and 50ft for my rear garden.3-4months and still in excellent condition!",4,Very satisfied!
0,0,"I probably should have bought something a bit more flexible and less rugged since I constantly coil/uncoil it for washing cars, but that's my fault not a product fault.",5,Very high quality
1,1,"I bought three of these 5/8-inch Flexogen hoses--50, 75, and 100 feet--for different areas of yard around the house.  After a season of use they've proven to be good hoses.  Of course, it's very favorable that they don't leak.  But what particularly impresses me about them is their notably light weight and flexibility, which make them a lot easier to handle than my previous hoses.  The flexibility diminishes in cold weather, but a garden hose is less useful then anyway.They're not especially prone to kinking, but they're not kink-proof, either, nor do they claim to be.  They kink a lot less than one of my old hoses and more than a couple of others, but the latter were fairly stiff, so there was a trade-off.Bottom line:  this was a good purchase.",5,Good Hoses
0,0,"I aqm impressed with the cost and quality of this product, Also impressed on the fast shipment by Amazon as I received it in 4 days, Has not kinked and a great hose as I had one before which I left in the yard during all seasons and even ran across driveway, But it lasted 5 good years through all the abuse,  I would recommend this to anyone, Thanks",5,GGGGGGGGREAT
1,1,"After using this hose I will never go back to small diameter garden hoses.  The water flows with much more force, which is especially useful when using the jet nozzle.  Most garden hoses are only 1/2"" diameter, and some premium hoses are 5/8"", but this is 3/4"".There is a significant water pressure loss with regular hoses because the smaller diameter means that more of the water is in contact with the walls, plus it flows at higher velocity further increasing the friction.  You'd be amazed looking at the charts, just how much pressure is lost with the cheap standard hoses.  For example:I'm looking at a plastic pipe friction head loss chart.  At 5 gallons per minute, the pressure friction head loss per 100 ft is 5.3 ft for a 3/4"" pipe (same size as this hose).  For a 1/2"" (regular hose size) pipe the head loss is 20.7 ft - that's 4x less height that the water can travel merely because of friction from the smaller inside diameter!I also noticed, this hose also has less tendency to kink.",5,More powerful water flow
0,0,This is one tough hose and it is thick and stiff.The connections are strong and the hose is industrial strength.I bought this to use with my pressure washer because it is 8 ply and 3/4 inch wide.My old hose was just rubber and it was flexing and twisting and there is no way this hose is going to do that.The hose is warrantied for life and unless there is a problem with a leak i don't think i will ever need to use it.The local big box stores do not sell a 3/4 50 foot hose and my pressure washer will not operate with anything longer than 50 feet.The price and delivery were great and Amazon is the best around if there is ever a concern.,5,WOW This Is Tough
0,0,"I'll buy more of these come  Spring. Holding up very well to the extreme heat and cold of Idaho.  A bit on the heavy side, but that is what makes them last so well.",5,Love it
0,0,So far so good! I have not really had the time to test out the hose as it is cold weather time right now. I bought this Gilmour hose based on all the recommendations. I am looking forward to not having to wrestle the hose to use it.,4,Flexible hose as marketed....hope it lives up to the hipe!
0,0,Hey Gilmore I have been buying your hoses for years and only your hoses. You stand behind your product and provide great customer support..  But I am only giving you 4 stars  because this hose and the 100 footer I bought  a few months back seem to kink more than my older Flexogens not sure why ?,4,have you changed the rubber formula ????
1,1,"This is a good quality hose that I use to connect to my ""Scarecrow"" so as to keep the deer away from my plants. It sits in the sun all day long and so far shows no sign of degradation.",5,Good Quality
0,0,I bought a cheap hose that didn't hold the pressure after 2 days.  This bad boy hold the pressure and doesn't leak.  Its not even expanding.  Great quality hose.  I will be keeping them in mind when I need more length.,5,This hose holds the pressure
1,1,"I was worried about getting a short one, but this serves my need just fine, as it accompanied by a longer and more troublesome one.  I leave the sprinkler on it instead of switching heads - so much easier.  slightly stiff to lay out, but if it weren't, I am sure it would kink.  I got it with the gilmore brass 2-way hose connector - an excellent pair for me",5,Just as hoped
4,4,"For everything I need for my lawn and garden work I try to find a Gilmour product.  They just can't be beat for the price and/or guarantee.  This hose is typical of a Gilmour item.  It is a strong and supple hose and like most other Gilmour products, comes with a lifetime guarantee.  I have cut hoses with my mower and they still replace them.  Quite a company!",5,Gilmour makes great products
2,2,"It's been outside in the hot (South Florida) sunshine 24/7, and still flexible. No crackles, and remains in great shape!A real bargain!",5,Been using it happily for over a year now!
1,2,"I've always been one of those people that bought the cheapest kind of hose whenever I needed one.  I don't do much in the way of gardening, nor wash my car that often.  So investing in a really good quality hose didn't make that sense to me.  The only flaw in that logic is cheap hoses have a habit of breaking and leaking just sitting there on the reel, whether you use them or not.  So in the long run you don't save much.  That, and the fact that cheap hoses also make you feel like you are wrestling a snake when using them for they are so stiff and kink like crazy.  When I decided to buy a better hose I came across this one and liked it immediately.  It's very well made and just about as flexible a hose you can buy without going for one of those new fangled shrinking hoses.  (I'm not sold on the long term quality of those).  This thing is a pleasure to use, as well as making it much simpler a task of rolling it up when you're done.  It kinda reminds me of what my cheap hose felt like when it was sitting out stretched in the sun for a while.  It would feel much softer and more flexible.  Something this does with or without sun.  Though its true that getting that flexibility carries with it a little more weight in the hose itself, its such a pleasure to use that I feel the trade off is well worth it.  It only takes a short time to get used to it being a little heavier anyway, and I love being able to roll it up on the reel when done so easily.  A top notch hose that carries a generous amount of quality, convenience, all for a fair price that I highly recommend... : )",5,Great Hose...Decent Price
80,81,"I've been in the Landscape Industry for over 60 years and have owned my own company for 23 years. One of the odder phenomenons I've experienced is that client's will spend $1,000 on a garden sculpture or $100 for a bottle of wine for a garden party but then they turn into Scrooge McDuck when it comes to sinking ANY SUM OF MONEY into the items required to properly care for the garden!Gimmicks abound in any industry but it seems that in the Green Industry, a Fool and Their Money is Guaranteed to Be Parted! Curly hoses, shrinky hoses, pink & purple hoses...the very item that delivers Life Giving Water is dismissed and ignored and people insist on spending the LEAST amount of money on a hose. Aside from the very important matter of a hose needing double walls to withstand the constant P.S.I. (pounds per square inch), a good hose also needs to have solid brass couplings, and have enough plys to avoid kinking.THIS hose delivers! Yes, there is heft to it's weight...that's what you NEED from a quality hose! And, it refuses to kink, even when you try to kink it as a test. I've bought Gilmour hoses for clients and my own company's use for over 17 years and NEVER needed to replace a single one! The 25 foot length is excellent to extend a longer hose for occasional use, rather than dragging that extra length around your property 24/7. Also, for very small Urban Gardens, rarely do you need more than 15 feet of hose so the 25' length is perfect for city gardens or roof top decks.Here are some tips from someone that works for a living with garden hoses:1) Use a cheap rope that you pick up at the Dollar Store to get the MAXIMUM LENGTH of hose you need. Mark that length down. Then, using the same rope, measure the NORMAL LENGTH that you will need on a daily/weekly basis. If the difference is more than 10 feet, BUY TWO OR MORE HOSES! Yes, I know that sounds insane but hear me out.If on a daily basis, you only need a 50' hose to reach your 40' garden, WHY are you buying a 100' hose to drag around? If you only need that additional 25 or 50 feet for the few times you wash your car or windows or fill a pool, buy some quick-connects and the extention hose length that you'll only use rarely. Hoses come in 10', 25', 50', 75', 100' and 150' length; ONLY buy the shortest length you need 90% of the time and then an additional hose to attach when needed.2) To coil your hose easily whether you store it on the ground or on a hose wheel, turn OFF THE WATER and keep the nozzle OPEN to drain the pounds and pounds of water that are trapped inside the hose! If you hate getting dirty hands, use garden gloves to coil it up and using the natural curl of the hose, just continue to coil it, turning the hose as needed.3) During the Summer, attach a PLASTIC SHUT OFF VALVE to both ends of the hose: the one connected to your home's spigot and also to the nozzle of choice. WHY? Because plastic does NOT corrode like any metal will do and if you have high minerals in your water, there are times that the hose coupling will actually become permanently corroded to the spigot or nozzle, making it completely impossible to remove! I know that we're taught that Metal=Good and Plastic=Bad but trust me...when I have to tell a client that they either need to replace a $70 hose or hire a plumber to remove a sealed/corroded coupling, that $2 dollar plastic gate valve becomes priceless!4) ALWAYS DRAIN YOUR HOSE, DETACH THE GATE VALVES AND STORE YOUR HOSE, VALVES AND NOZZLE IN A FREEZE-PROOF AREA!!! If I don't do it for my client's and trust them to do it, it never gets done. And after the first hard frost, trapped water in nozzles, hoses and valves expands and can destroy all of the above in one night. It takes less than 30 minutes to winterize two hoses and attachments; figure out the cost of replacing everything in Spring when you find them all destroyed!5) One of the best ways to RUIN ANY HOSE, is to tug-tug-tug at the coupling, which breaks the weld and suddenly you have a leak that can't be fixed! I simply make a small loop in the end that attachs to the house which acts as a ""brake"" and takes the pressure off of the coupling and spigot.I only recommend landscape items that I trust to use with all my employees and on all my jobs. When I gain new clients, I teach them the benefits of a good hose and order it for them, never having to do it again. Buy one less bottle of good wine and use that cash for your hose. You won't be sorry! :)",5,Landscaper Approved!
1,1,This little hose was purchased to add on to my other 50 foot hose due to the very humid and oppressive weather this last month in the Northeast.  It is very flexible and easy to handle and allows me total reach of the back perennial garden.  i would recommend this hose,5,Gilmour 8-ply Flexogen Hose 25 Foot
0,0,"There is only one thing wrong with this design:  the spray shape and the water volume can not be controlled independently. Better designs have one control for open-closed and another for spray shape. That makes this nozzle useless for filling buckets and other close applications. It is impossible to get high volume at low pressure output.That said, the simple design is almost bomb-proof and the price is fair.",4,standard product
1,1,"This is definitely a good quality nozzle. It is similar to the ""old fashioned"" type nozzle we had as kids. It gives differing spray patterns depending on how far you squeeze the trigger.",5,pistol grip
0,0,"It looks like it came right out of an episode of Leave It To Beaver but don't be fooled by this retro-looking nozzle. This feels great in my hand and functions way better than the plethora of nozzles I have tried in the past. The trigger has a real nice, snappy, feel to it.Unlike my other nozzles that are made from plastic, I actually think this will survive a winter outdoors in PA. The only thing I have to get used to is that the type of spray is determined by the pressure I apply on the trigger. Everything else about it is perfect.",5,Never thought it was possible to love a hose nozzle!
1,4,I am very happy that I bought this nozzle. It is exactly what I wanted. Good quality and I highly recommend it. I really need it too.,5,Gilmour Full Size Zinc Pistol Grip Nozzle
0,0,I have bought many types of nozzle over the years and this old timer which I used to use when I was growing up served me well this past season.,5,Nozzle
0,0,"This is a nice hose nozzle - simple design, sturdily made and inexpensive. It can go from high-powered jet mode to gently spray just by loosening your grip. It also doesn't leak at all where it attaches to the hose!My only gripe would be that when you use the widest spray pattern, it can come out unevenly –e.g., it's not an even ""circle"" of water coming out, which makes watering evenly a little challenging. But it's not a big deal.Get one, you'll like it.",4,Simple... sturdy... inexpensive...
111,114,"Nozzles exactly like this have been around for at least 40 years--manufactured in a dozen companies--and sold under a wide variety of brand names---for a very good reason---they are the best design.  They are perfectly and easily controllable, durable, and don't leak.  You can get ""prettier"" versions with plastic covers over the grip and plastic handles, if ""pretty"" is your priority---but, functionally speaking, you can't buy a better designed garden hose nozzle.THUMB SCREWNote the little thumb screw at the end of the piston can be used to adjust the type of spray when the handle is maximally squeezed.  If you wish, you can tighten the screw (you may need pliers to do so, and/or you may need to grease the screw threads) back from full unfocused flow to the tightest stream for long throws---that makes long throws a little easier.LOCK-ON LOOPNotice the small wire loop at top---when the lever is complete depressed, you can rotate the loop back to prevent the lever from closing, and then you can release your grip.  So, this is a ""lock on"" device, which becomes particularly useful when you use the brass screw to adjust to the pattern you want.  For example, if you always want a medium cone spray, you can adjust the sprayer semi-permanently to that setting.NOT A VALVEOne reviewer complains that there is no ""medium"" strength, e.g., for filling buckets.  What do you expect?  The actual ""problem"", as far as that reviewer was concerned, is the nozzle is ""too good""---it delivers full pressure, at all but the tightest mist setting.  Although it does have a ""closed"" position, this is a nozzle, NOT a valve. If you want a VALVE to reduce the PRESSURE, then install aMelnor 390S Hose Shut-Offor aGilmour Brass Garden Hose Connector With Shut-Off Valve 03Vjust before the nozzle.  Or, close your faucet part way.  Alternatively, to fill a bucket, loosen the thumb screw, then ""open 'er up"" (squeeze the handle all the way)---the result is is maximum unfocused flow, which is perfect for very quickly filling a bucket, etc.COMPLAINTS OF OTHER REVIEWERSMany reviewers (of this and other products) write reviews about different, but similar-looking, products.  Many of the complaints are about sprayers which are NOT ""Gilmour 572TF"".  If you find a sprayer that looks like this in ""bargain bin"" at your local hardware store---it probably is not a ""Gilmour 572TF"", unless the packaging says so.  Sometimes when you order from an Amazon Vendor (rather than Amazon itself)---you don't get exactly the product described.  I'm NOT saying that Gilmour is always the best, but only that THIS review is about the ""Gilmour 572TF"", and other reviewers 1-star reviews MAY not be.CAVEATSHere in the tropics (South Florida)---the year-round heat is hard on all garden tools.  After a year or two, the zinc metal body can seize on your hose and be difficult to unscrew.  I suggest greasing the screw threads with silicon grease when you install it on the hosePermatex 22058 Dielectric Tune-up Grease - 3 oz.If you don't have silicon grease on hand, buy a tube---it terrific for improving electrical connections and refurbishing rubber items, and even for lubricating things such as this.  While you are at it, lubricate all your hose connections (both the threads and the seals) to prevent leaking and to make it easy to screw-on and -off the hoses and accessories.Why not petroleum-based grease?  Petroleum-based grease damages rubber seals.  However even petroleum grease is better than no grease (besides most hose gaskets are now plastic, not rubber)After 2 or 3 years of abuse the action can get begin to get stiff, presumably caused by internal corrosion (or the original grease having deteriorated or lost).  The handle (the lever in back) is steel, and can rust.  Ultimately the stiffness plus the rust results in the handle breaking (after 5 years or so of abuse).  Ideally, keep the nozzle dry---at least don't keep it in a muddy puddle, or half-buried in acidic soil.  It is good idea to lubricate the piston with grease when you start to notice it getting stiff. (With the water off, squeeze the handle to expose the brass rod.  Apply a liberal amount of grease to the piston).  If the nozzle is very stiff, take it off the hose, spray it heavily with WD-40, let it soak for 15 minutes or so---that will probably adequately loosen it up, but is not a permanent solution---you still need to grease it.But those are the extremes---reasonably well taken care of (or at least not abused) a nozzle can last 10 years or more.ALTERNATIVES> Folks with arthritis or weak grips may be happier with traditional brass nozzles, such asDramm 12380 Heavy-Duty Brass Adjustable Hose Nozzle.  These are virtually indestructible, and hold any particular spray pattern until you change it.> Those ""prettier"" versions of the zinc nozzle with plastic handles I mentioned may be more pleasant to use in the winter, and might get the wife's approval.  Often these are only 50 cents or so more than the 573TF, and in that case are clearly better choices.Gilmour 572TFR Commercial Insulated Grip Nozzle with Threaded Front, Red,Gilmour Comfort Grip Nozzle with Threaded Front 593 Black,Gilmour 572 Insulated Pistol Grip Nozzle.> High quality all plastic versions are available for use around salt water.Gilmour Salt Water and Marine Nozzle 474S> There are cheap plastic versions you can get for $1--$2 in ""bargain bins"", which are a good deal for the price, but are not nearly as durable, and through an Amazon vendor when you add shipping your total cost is the same as a zinc or high quality plastic sprayer.> There are versions with spray-pattern or nozzle heads on the front---but that sabotages the virtues of the basic design, reducing the sprayer body into a mere valve.  You'd be better off with a brass nozzle sprayer mentioned above.  I find constantly having to rotate the head to select the 1 or 2 spray patterns I use to be very annoying.  For example (not recommended)Gilmour Pistol Grip Nozzle 327 Teal/Red> If you (or your wife) insists on a ""pretty"" nozzle with s electable spray patterns, I suggest the hybridGilmour Select-A-Spray Comfort Grip Nozzle 594 Black/Tealor Gilmour Select-A-Spray Metal Nozzle 584.  One setting is the full-action, and there are several selectable patterns.NERD CORNERThe zinc body corrodes through electrolytic action.  I.e., the zinc will ""sacrifice"" itself (and corrode) to protect iron or any other metal of lower electrolytic potential which it is touching, or with which it is sharing a conducting solution (such as a water-saturated acidic soil), or salt-water .  So try to keep it dry and away from unpainted, ungalvanized steel, or salt water.  (Galvanized steel is iron coated with zinc for this very purpose, to prevent the iron from rusting--not as a barrier like paint, but rather by electrolytic action).What about those other pretty, fancy, mostly plastic sprayer nozzles (which cost 3x--4x more) that you see at the garden center?---they don't work nearly as well, and won't last nearly as long.  I know this for a fact---my wife keeps buying them---indeed we have a bin of discarded (mostly still functional) ""pretty"" sprayer nozzles, which have ""fallen out of favor"" for various reasons.",5,Does the Job
1,1,"I've tried all sorts of nozzles for my hose and they either break, get stuck on the end of the hose, or don't have enough power to really blast things with water. This nozzle is durable, easy to remove, and super strong!",5,stick with the classic
1,1,"metal too soft, its all wore out after light use, the thread on front already smooth out.lots rust on the back puller/handle part, need something with better material, rather buy once and be done with it for many year.",2,metal too soft
1,1,"I've always bought cheap sprinklers that would ineffectively water the lawn and me, too. It killed me to spend so much on a sprinkler, but I've probably sunk so much on junk sprinklers in the past 10 years and bit the bullet after reading the reviews for the Raintrain. Convenience alone makes this sprinkler really attractive, but it does a good job and that is a real draw.Operation is easy. Extend the garden hose where you want to water as the hose is the 'track' that the Raintrain runs on. By adjusting the time and the pressure you essentially control where you water and the degree of water used. Then sit back and enjoy as  the Raintree does the work.  No more moving the sprinkler or possibly getting showered. It doesn't get much simpler.The spray is low and slow so everything gets watered more effectively and there is less evaporation. My lawn really looks better than it had when I used my old sprinkler.I use this in my garden  and it does a good job keeping all my perennials and herbs staying healthy and lush.This sprinkler is well made and worth the higher than average price.",4,A Cinch To Operate
1,1,"There are some positive features about the Nelson Raintree Traveling Sprinkler that makes is an excellent sprinkler, and a good one to have if one has a large lawn. It's definitely sturdily built, and with a steel body, it appears nearly indestructible. Because it's a ""traveling"" sprinkler, once you have it set and have placed the hose in the middle of the track you want it to cover, it will move on its own and give a wide area of lawn a thorough sprinkling. One doesn't have to run out every little while to move the sprinkler so that it can water another patch of ground. Also, there's a little ramp you can run the hose through so that when the sprinkler has completed its intended course it reaches the ramp and shuts off on its own. This is particularly useful if you're not going to be around to monitor it.Now, a couple less positive features. First, this is an appropriate sprinkler only for those parts of the lawn that are relatively wide open and devoid of obstacles. We have a number of large trees in both our front and back yards. Also, we have tree rings and the like, which mean that parts of our lawn are isolated from the rest. We need a second sprinkler to cover these parts. So, buy this only if you have a large enough amount of open space to make having one worthwhile.Second, it is a very heavy sprinkler. I realize that this is the price one pays for a large metal object. But if you want a light-weight piece of equipment, this isn't it.",4,Sturdily built
