helpful 1,helpful 2,review,rating,summary
8,9,"I'm not even sure where to start!  I've wanted to add a charcoal grill to my outdoor cooking fleet for many years just for those few times that I'd like to cook more naturally.  I've used this one 2 times so far and can't believe I've waited this long.  I think it's saved me over $1000 I was going to spend to replace my 10 yr old gas grill.This grill and a couple Weber accessories make charcoal grilling a breeze!  I haven't grilled with charcoal in years and obviously I had cheap junk for grills in the past.The quality of the grill is great, but I expected that.  I can see it lasting years and years as many others have attested to.  I'll easily use it even during the week when I don't have the time I thought it would take and thought gas was easier for.  The first use and trying to get used to charcoal again was almost a failure because I almost choked the heat down keeping the vents closed.  When I realized that the steaks slowed down cooking and the kettle top got wet from condensation it hit me that I had the vents closed thus the fire couldn't breath.  All I had to do was open the vents and 'viola, in no time the heat was back up and going strong with no other help from me, just air.Yesterday I outdid myself with ribs. Although I did cook them a little to high, they were the best I've ever done both falling off the bone and the best flavor I've ever gotten.  I was using Mesquite chips as well but I've done that on a gas grill and cooked twice as long and didn't get near the same results.  It's amazing how the kettle makes all the difference in the world keeping the charcoal hot and lasting a long time.  I'm amazed!Clean up is much easier than I expected.  The ash catcher is awesome, even in high gusty winds.  Access though the grill for adding fuel makes adding briquettes and wood a breeze.Assembly was easy and took less than 20 minutes taking my time.The only con I can come up with was that on the top handle, it came out of the undamaged box with a chip of the porcelain coming off as if it had been hit.  It's small and by the handle and not exposing the metal so it's not a functional problem but with the box arriving in perfect condition, it's obvious it happened before being packed.  However, I'd be surprised if anyone could find it.All I can say is that I'm sold!!  Everything Weber that I've bought, from the grill to the accessories, have been top notch. Charcoal grilling is now a breeze and so much better than gas.  The old saying is absolutely true; having the right tools make all the difference in the world.  The Weber Kettle is absolutely the right tool!!  Being made in the USA is the cherry on top!To address some of the complaints in the lesser ratings:The handles don't get hot.  As hot as mine has been, the handles are easy to hold with bare hands, although I tend to use a mitt around a grill.  The new handles should last in any weather condition and much longer than wood as well.It would be nice to have a temp gauge but that's not hard to add if you really need one.  I can see the benefit but it's limited.The Kettle is not unstable if it's put together right.  If it falls apart after assembling, the legs aren't being secured fully as they should be, which is to tap them all the way in.  Rolling it isn't a problem but like with most anything, you have to be careful.  Depending on which way you roll it, one might be able to knock it over if not careful, but I've not found that to be easy to do.  Standing, it's as stable as can be.  Again, if it's wobbly or falls apart as one has claimed, the legs were not assembled properly.The lid DOES have a hook to hang on the side of the kettle; it's on the underside of the top near the vent.  It hangs nicely on the side of the kettle.",5,"Weber 22.5"" One-Touch Gold Kettle Grill - Awesome!"
1,1,"We have a similar model One Touch Premium home (Germany) and the quality of Weber pays off. I brought the old chinese bbq to trash today ;-).The Weber is very solid build and comes ready to go with drop pans and charcoal holders (wires). Bought a chimney from Weber since the reviews were so good. Tried direct and indirect, keep on training.Will not to back to chinese quality again.Since we live in Northern Germany usage of this bbq is limited to summer time, completed with a Q200 grill.",5,Terrific quality
0,0,"Our gas grill finally rusted out after 15 years. I was ready to spend $700 on the 320 but started asking myself why? Grilling outside is for leisure, take your time, relax and enjoy the flavor. So I opted for this Weber One Touch Gold - what I have been missing all these years!This grill is so easy to use. I didn't get the chimney starter, I just place some newspapers under the charcoal and it works just fine. I am usually grilling in about 15 - 20 minutes. The ash collector is fantastic, the ashes don't blow around and it makes it easy to remove the leftover ashes. I got blue, it really looks great. The little hook inside the lid makes it easy to set it aside so you have both hands.This is going to be a great summer - now if we could just get some sun here in the NW!",5,Made the switch back to charcoal
0,0,"Order this blue grill a week ago and got a defect with 2 big black dent on the side on the cover exposing the inside metal. I was a little disappointed. Try to contact Amazon customer service on the web and was amazed that they have a ""please call me"" service. I just typed in my phone number and they call me right away. The return for a replacement is painless and they order a new one for me right away. All I need to do is put the damaged grill in the original box, re-tape it, leave it outside my front door. UPS was here the next day, pick up the box and return to Amazon. That was really easy.I finally receive my new blue grill today. It is perfect and only took me 10 minutes to assemble it. The ash tray needs a little adjustment with a plier and now it is working perfectly. I have ordered a work table and putting it in is a snap.  I also got the smokenator and it fit perfectly inside the grill. Try the cover and it fit perfectly and no gap in between with everything in place. I am a happy camper and ready to do some bbq this weekend.  The blue color looks really nice in my backyard for an extra $10.So do not get despair if you get a defect, just keep returning and you will eventually get a perfect one. It worth the wait.I am glad that I only need to return it one time. On my reasons of return, I mention this grill is defective and should not put back on the shelve and send to other customers. I also contact Weber and let them know about this so they can improve their product quality control in the future before boxing their products and send to the distributor.Hope this help and good luck.",5,"Beautiful grill, love it"
0,0,"We ordered this for the FIRST time on February 5, 2010.  My husband was so excited and rushed out to buy charcoal, cleaning brushes, etc.  When we got it and he opened the box we discovered one of the handles was bent, and there was a large section that had no protective paint over it, making us fear it would rust prematurely.  Needless to say we were disappointed.  He boxed it up and I called Amazon, and they were great!  They immediately sent us a return packaging slip, and placed a new order (at upgraded two day shipping no less) for us.  So, once we got all that straightened out and got the second one (which looked great by the way) we unpacked it and looked forward to making the chicken we had prepared.My husband put it together and brought it over to me and I must say, the blue looks a heck of a lot cooler than the basic black!  This is the upgraded model with the reservoir for ashes, and while I don't do a lot of grilling, my husband really appreciated this aspect of the grill.It was easy to put together, and Weber has a wonderful reputation when it comes to grill products.  The chicken we cooked on it came out wonderfully, though we have had a gas grill for the past few years, so the extra time a charcoal grill takes will take some time to get used to.All in all well worth the money.//Update March 2013: Wow. Has it already been over 3 years? I guess it has. This grill is still going strong. We clean it regularly, and keep it covered with one of the standard Weber grill covers. It has no rust and still cooks some great food. The ash catch is an absolute must have with the charcoal grills. Still very pleased with this purchase. Especially seeing as we've had other grills fall apart in little over a year.",5,Let me Explain
1,1,"I love BBQ. For convenience I have often used a gas grill, but really do love the taste of meat cooked over charcoal (PAH and NCA risks notwithstanding). I have often cooked turkey breasts for Thanksgiving, and particularly love the smokey flavor that comes with it! Alongside baked potatoes and fresh veggies (extra nice on the grill), I have a special meal that is actually healthy.So when my last gas grill bit the dust, we went back to the old fashioned way of cooking! Real charcoal, real delicious smell, real delicious flavor! I suggest that you consider using theWeber 7416 Rapidfire Chimney Starter, so that you can have the purest taste without any chemical oders.A funny thing happened when a dear friend came by to visit ... Her son was entranced by the fact that we didn't have any fuel for our BBQ.  Times change, but old fashioned flavor doesn't. This grill made  the move with us recently and now sits on our new deck waiting for spring, or at least a nice sunny day!",5,Used for several years
1,3,Great Product! Makes it fun and easy to Bar-B-Que.I have a Weber Gas Grill and use it all the time. However when I want that real charcoal flavor nothing beats this Weber Grill. The ashes just fall into the bottom for easy removal.A great product and reasonably priced.,5,"Weber One-Touch Gold Charcoal Grill, Black"
0,0,"the grill is fine, but what i was really hoping was the clean up of the ashes was actually ""one touch"".  perhaps you can get used to it, but removing and re-attaching the ash-catcher is a bit of a pain.  there are much better ways to design an ash catcher that would be easy to remove and re-attach. oh well...hopefully weber will spend some money on a re-design for the ash catcher in future models.",3,"""one touch clean up"" - not quite"
1,1,This is my second Weber...the first lasting me about 7 years. We like charcoal (instead of gas) and the Weber is a wonderful all-around grill.,5,Love this grill!
203,205,"When it came time for us to get a new charcoal grill I searched every site and checked out dozens of different grills, some costing many hundreds of dollars, all promising some advantage.Some units were really interesting, and not too expensive, but upon close inspection many of these proved to be tinny and cheaply made. The very expensive systems were very nice, but did not offer rotisseries and other useful accessories and were just too expensive for us anyway.So, we ended up with another Weber, the Gold Model. In the many years since our last Weber, there have been a lot of improvements that kept it attractive. The ash catcher really does make cleanup much easier and the vent system is more functional. The grill itself has the new flip-up hatches that allow you to add more coals and move them around without having to lift up the grill. I did that all the time with the old grill.The optional little bent-wire style of charcoal retainers do help to keep the coals out to the side when you want to use a drip pan in the center.Others have recommended the chimney style charcoal start for ecological reasons. It is also just plain faster to use as well, and it is made of heavy gauge metal that is both attractive and long-lasting.I love the optional rotisserie (see those reviews) and it comes with an extension ring that is also useful for other cooking options.We got the green colored kettle and it looks very nice on the patio. The general design and those odd white-wall tires give it a kind of vintage look.This is a well-made and very functional grill with all sorts of interesting available accessories that really work well. There is a reason for the popularity of the Weber. I looked, I bought. Hard to beat................Update 7/2012. Still good, used daily all summer and even in the rain under my porch cover. Something I came up with that could be interesting to the more dedicated user. I essentially bought a downed oak tree and have been splitting it for firewood for next winter. Had a lot of small, crooked, knotty, twisted pieces that couldn't easily be split. I cut them up into 1"" cubes on a band saw, hoping to use them as briquettes in the Weber. A newspaper sprinkled with cooking oil got them started in the Weber chimney starter quite quickly. The secret is to be a bit patient so that they stop flaming and turn to glowing coals. And then you have a genuine oak BBQ, just like on a ranch. Very good, but a lot of work and dangerous enough even on a band saw. And it messes up the blade and rollers. The other more accessible method would be to simply start an oak campfire in the Weber, using regular old pieces of oak like you would in a fireplace. It would take some time to burn down to coals, but even more of an excuse to drink too much and then burn the food because....well, everyone has done this. Right? Anyway, flaming oak imparts a kind of bitter taste while glowing oak coals make it delicious. I do this research for you.__________________________Update 2, on cooking an expensive steak. This works and requires no skill. I went out and bought the most expensive steak ever, an organic, grass fed, free range whatever ribeye at a boutique market and the attractive butcher girl probably had her thumb on the digital scale besides. I about died when I saw the price. Hmmm, can't afford to cook this any way but perfectly.I once saw a YouTube video on how to properly cook a steak using high heat and this is my BBQ grill interpretation of that.Use the coal retainers to block off a section of the lower grill and fill up that smaller portion with lots of hot coals. It cannot be too hot in this case.Put on the cooking grill and let the previous session's grease flame off, which of course also heats it up hotly and is somewhat entertaining and makes you feel guilty about what you are eating...Put on the steak. Having those long tongs helps a lot. You can rub it with olive oil if you want, but it is unclear to me if that is necessary and it causes more flame-ups. No BBQ sauce though. Lid off! Deal with the flame-ups by maneuvering the steak around. Some people use a water spray. This is hands-on, attentive work.Stand by. It will cook fast. Have your other food well under way. Within minutes the down side will have that crust of goodness, short of burnt of course. Turn it over and do the other side. When that side is seared, remove the steak and insert a digital cooking thermometer, taking care to place it in the very center, from the side (not stabbed in from the top).  I use a Polder and the line from the sensor to the display seems to hold up in high heat, but don't string it out over the coals. Run it out the back. Set the alarm for 130.Put the steak back over the un-coaled area. The effect now is that this is a very hot oven, not a grill. Put on the lid, make sure all vents are open. Watch the temp rise, amazingly fast so don't wander off.Remove the steak, with tongs, to a plate and cover it with aluminum foil, resting it as they say on cooking shows. By the time everything else is served up, maybe 10 minutes or so, it should be ready to serve.This gives you a steak that looks exactly like the ones in advertisements, medium rare with a great crust.  You can throw it back on and in a couple of minutes the temp and doneness will go up. There is no shame in putting food back on the fire, but there is shame in over-cooking it! If you paid the big bucks for your meat, burning it will make you cry.BTW, this works for other meat like thick cut pork chops (thick ones are easier to cook properly). Use the same method, but run the temp up to 140-145 (145 being the new govt standard, and in fact it is the standard for all meat other than poultry. If you were brought up on thin, over-cooked pork chops (we all were) you have a revelation coming. Chicken parts don't require the high heat, but a quick sear and off the the oven part works very well for them.It is suggested that the steak be served with salt and pepper, applied after it is cooked as it may be a bad idea to subject the salt and pepper to high heat. The more expensive the meat, the less you should put on it. Cooks always suggest kosher salt and it is indeed very good for this, and ground pepper is better as well. I really think BBQ sauce is too much for expensive beef, but if you want to fancy it up, slowly heat up some butter and garlic and let it meld together. Strain it and serve it on the side, or simply pour it on. What the heck, you have already gone well over the fat grams or whatever for the month anyway...If you have to cook more than maybe 3 or 4 large steaks, you could fill the entire bowl with coals and then finalize them in the kitchen oven set very high, like 450, and with the temp probe stuck in the most representative steak. This gives you 90% of the grilling experience and taste.",5,Hard to beat
1,1,"I have used a number of different charcoal grills, and the Weber Gold is the best.  Unless you want to spend twice the price and buy the Weber Performer, which is a Weber Gold with gas ignition, table, and a place to store charcoal. Not sure why you would want to store charcoal outside where it can absorb moisture, but that is another story.First off the Weber is made with a thicker steel, so it retains the heat better than the cheaper, lighter, offshore made products.  The grill is heavier, so you can get more than one season out of it.  The ash catcher is great.  Its a must have feature.  Other units get ashes all over my deck, which is unacceptable, and a fire hazard on windy days.My Weber Gold is about 10 years old.  I replaced the cooking grate once.  It still functions perfectly.  It lives outside and only has one tiny spot of rust, where the cover got hit with a rock and it chipped the paint.  One day I will get around to sanding and painting that spot so it lasts another 10 years.  The aluminum portions of the grill are a little weathered, but still function perfectly.  I guess if I really wanted to I could polish them up, but a little oxidation does not bother me.The only downside I can even think about is the top handle.  It is plastic, not wood.  Sometimes it gets too hot to handle so I have to use a potholder if I am cooking at a very high temperature.  Other than that, it is the best charcoal grill on the planet.Sure you can buy one cheaper, but they will not last.  Buy a Weber and you will leave it to your children when you die.  And they will get many years of use out of it too!",5,"The best charcoal grill available, 12 years and counting..."
0,0,"This grill works great. I love the one touch ash disposal feature. Have purchased the Rotisserie attachment also, and I LOVE what these two peices of equipment do to my Roasting Chicken!!  It will Rotisserie a small Turkey also, leaving it so jucy and tender. Will be using this for many years to come.",5,Excellent grill by Weber!! Great investment!!
1,1,"I had alwayws wanted to get a barbeque grill ever since we bought our home last year. I had been debating between 751001 and 741001 for quite some time, finally decided to go with this one for its ash catcher and it turned out to be a wise decision. Installation of the grill was fairly easy even for me. We had three families of visitors when we tried it the 1st time, we cooked a lot of meat, pepper, corn and etc, it was awesome. We have used it three times already within the 1st 10 days after we received it, it's gonna get a lot more use this summer.",5,Weber grill
0,0,"You can grill/ bbq/ smoke just about anything shy of a half a large animal on this. Im glad I went with the 22.5. Will move up to the 26 later when needed. There are so many things you can do with this when adding other attachments (smokenator, rotisserie, pizza oven, iron grates, wok, skillet, the list goes on).",5,Its a machine!
0,0,"This BBQ grill lives up to everything written about it and the quality is quite good. The new feature of detachable ash catcher is definitely worth having. This grill cooks burgers and steaks to perfection, once you get accustomed to how to arrange the live coals (using more or less heat, etc). I would recommend this grill for anyone wanting an excellent charcoal grill.",5,Excellent cooker
6,6,"Setup was easy on this grill after I realized that I will have to scrape the tabs of the ash catcher ring down the small leg posts. At first I did not like the idea of scraping my nice new grill, which is why I temporarily stumbled on the instructions. They pop in nicely once you get past this. The 3rd leg kind of twirls on which is quite obvious once you start fiddling with it but the instructions have no words so the pictures are not as self-explaintory as I would have hoped in these 2 areas.My only complaints on this grill are the legs and the handle. The legs were wobbly and not as secure as I would have liked them and they were installed all the way to the base of the grill (as the picture showed)  some nuts and bolts would have went far in this area.The handle gets to hot to handle with bare hands. especially when doing large meats like roasts or whole chickens. Wood would have fixed this problem. I wrapped mine with some small rope (not string) and it helped a little.All said and done it's a great grill. Get it.FYI-The Weber 87886 Chimney Starter is incredible and it's only 12 bucks. Get that too.Weber 87886 Chimney Starter",4,"If you scrape and twirl a little, set up is a breeze"
0,0,This grill is wonderful!  It cooks really evenly and the lid can hang on the side of the grill while tending to the food.  The hinged grate is great for adding wood chips for flavor.  The ash catcher makes for easy cleaning of the ashes and is worth the few extra bucks.  Our grill arrived in perfect shape and was very easy to assemble.  We use it almost every night.  This grill is sturdy and heats evenly and has the Weber name behind it.  We expect to be using it for many years.,5,Wonderful grill
0,0,"Easy to assemble, though I will admit that one of the wheels keeps popping off the side when i roll it around my patio.  But then again, i rarely have to move the grill so it's not like it's a big deal.  The grill is large and easy to clean and the thing that stands out most with this grill is the ash-catching compartment on the bottom.  Plus my steaks taste way better using this thing compared to my previous grill which used propane",5,The King of Charcoal grills
1,1,"I purchased this grill, but I was surprised at how much I enjoyed cooking on it.  With the chimney starter, it is almost as fast to get this grill ready to cook as it is to get a gas grill ready - and you should let your meat set out for about 20 minutes before you grill, so you really haven't lost that much time.The ash catcher is a great feature and don't forget to get the rotisserie attachment.  You haven't had turkey for thanksgiving until you've had a rotisserie turkey!Real Men cook with charcoal and wood and this is the best grill I've ever owned.",5,Best Grill Ever!
0,0,I bought this for the simplicity of clean up.  I wish the kettle had an adjustable coal grate to lower or make higher the direct heat.  It takes a while to get it just right with the right amount coal.  But overall great quality.,5,Weber Grill fan
0,0,This is the best charcoal grill I have ever owned. I have cooked ribs at 225-250 and been able to control the fire easily. I used the 2-2-1 method on a rack of baby backs and never had to think about adding charcoal over 5 hours. By using the vents you can get wood chips to smolder for an hour and not flare up and burn away in minutes.  The ash pan holds at least three cooks worth of ashes and does not leak.  I feel comfortable cooking on my wooden deck because of the ash pan. The only addition i would make is the Craycort cast iron grate.,5,Great Grill
3,6,"This grill performed as advertized in the reviews here.  Assembly is easy and takes less than a half hour.  The cooking time is longer than other charcoal grills, but is more uniform because of the ceramic cauldron reflective characteristics.  I also bought the stainless steel tools and the tool holder.  The latter ships separately from another company and the shipping/handling is about twice as much as the tool holder.",4,Good as promised
